{
  "task_id": "bmad-yunshu-enhancement-v1",
  "context_id": "bmad-yunshu-enhancement-v1-deliver-20260513-093316",
  "phase": "deliver",
  "created_at": "2026-05-13T01:33:16Z",
  "updated_at": "2026-05-13T01:33:16Z",
  "sources": [
    {
      "path": "README.md",
      "exists": true,
      "sha256": "d593941d68b719e0782862f7f16d91d2c26e07eae0418d41c8ac8e6c47d8cb28",
      "size": 29795,
      "modified_at": "2026-05-13T01:32:14Z"
    },
    {
      "path": "SKILL.md",
      "exists": true,
      "sha256": "69b01628763112fb1e95d52c72568692bb539be2b87a300c75906dc69256a7ed",
      "size": 17646,
      "modified_at": "2026-05-13T01:29:22Z"
    },
    {
      "path": "scripts\\yunshu.py",
      "exists": true,
      "sha256": "be82e71be9f9785de93dc18601db0b369289f7cef323b8825cc7ac9423db65b9",
      "size": 44771,
      "modified_at": "2026-05-13T01:23:52Z"
    },
    {
      "path": "schemas\\bmad_mapping.schema.json",
      "exists": true,
      "sha256": "ddb5e8e62b7fd9a0dab3371702e037c121efc43b5972e81647464a42e33d7f81",
      "size": 2388,
      "modified_at": "2026-05-13T01:24:37Z"
    },
    {
      "path": "examples\\bmad-mapping-demo\\README.md",
      "exists": true,
      "sha256": "f947e33cae60ecb1b1c697f345276a156cc28ffe007bbd4258a8480fd33c35b7",
      "size": 1359,
      "modified_at": "2026-05-13T01:28:01Z"
    }
  ],
  "findings": [
    "最终复验通过：audit links、version-check、pytest tests、四个 demo bmad status 均通过。"
  ],
  "actions": [
    "修正 README 目录树排版，不改变行为。"
  ],
  "decisions": [
    "BMad × 云舒增强层 V1 完成到 3.6.0，可交付审阅。"
  ],
  "gaps": [
    "真实 BMad 官方产物校准仍可作为后续增强。"
  ],
  "next_read": [
    "后续从 bmad-yunshu-enhancement-v1-deliver 检查点和 examples/bmad-mapping-demo 继续。"
  ]
}
