{
  "task_id": "bmad-mapping-demo",
  "context_id": "demo-prd-map-context",
  "phase": "plan",
  "created_at": "2026-05-13T01:27:13Z",
  "updated_at": "2026-05-13T01:27:13Z",
  "sources": [
    {
      "path": "examples\\bmad-mapping-demo\\PRD.md",
      "exists": true,
      "sha256": "0f7e6d6d2da9b531a0541f46596598e0daa21157f8affdc90e8f7e4a6e8e899a",
      "size": 774,
      "modified_at": "2026-05-13T01:26:40Z"
    }
  ],
  "findings": [
    "BMad prd mapping recorded: demo-prd-map"
  ],
  "actions": [
    "Created .yunshu/bmad/demo-prd-map.json"
  ],
  "decisions": [],
  "gaps": [
    "Default limit needs product decision"
  ],
  "next_read": [
    "examples\\bmad-mapping-demo\\PRD.md"
  ]
}
