{
  "task_id": "yunshu-system-component-remediation-20260528",
  "context_id": "yunshu-system-component-remediation-20260528-deliver",
  "phase": "deliver",
  "created_at": "2026-05-28T14:22:33Z",
  "updated_at": "2026-05-28T14:22:33Z",
  "sources": [
    {
      "path": "SKILL.md",
      "exists": true,
      "sha256": "3c04a381fe4583a487f0154b73b1e721be8da71f053f0069c0f8cf7800c2b965",
      "size": 22936,
      "modified_at": "2026-05-28T13:20:18Z"
    },
    {
      "path": "components"
    },
    {
      "path": "scripts"
    },
    {
      "path": "reports\\yunshu-system-component-remediation-20260528.md",
      "exists": true,
      "sha256": "782ab3b1edba9e4ff2a07e0e45da84a0525790a5a0e44baff0cd55f752e9e704",
      "size": 4922,
      "modified_at": "2026-05-28T14:19:49Z"
    },
    {
      "path": "reports\\yunshu-system-component-remediation-evidence-20260528.json",
      "exists": true,
      "sha256": "96c6d7b6d2de5a6aa66f588b54b6ca6989622913bbfd8c19d954c8ccc2281636",
      "size": 2060,
      "modified_at": "2026-05-28T14:19:49Z"
    }
  ],
  "findings": [
    "Fixed cross-platform 01-init wording, removed duplicated legacy compliance files, added metadata to 29 SKILL.md entries, enhanced health gates for metadata/cache/size, and documented file-scale assessment."
  ],
  "actions": [
    "Ran health, link, version, pytest, py_compile, evidence validation, duplicate scan, and cache scan."
  ],
  "decisions": [],
  "gaps": [
    "Historical reports still mention old paths by design",
    "README and scripts/yunshu.py are near size thresholds and should be split if they grow materially."
  ],
  "next_read": [
    "reports/yunshu-system-component-remediation-20260528.md"
  ]
}
