{
  "task_id": "bmad-mapping-demo",
  "context_id": "demo-architecture-map-context",
  "phase": "plan",
  "created_at": "2026-05-13T01:27:13Z",
  "updated_at": "2026-05-13T01:27:13Z",
  "sources": [
    {
      "path": "examples\\bmad-mapping-demo\\architecture.md",
      "exists": true,
      "sha256": "724ad87ffea0a675240154245a8b687a011acc466a98a440e252acbd7b58ce45",
      "size": 806,
      "modified_at": "2026-05-13T01:26:40Z"
    }
  ],
  "findings": [
    "BMad architecture mapping recorded: demo-architecture-map"
  ],
  "actions": [
    "Created .yunshu/bmad/demo-architecture-map.json"
  ],
  "decisions": [],
  "gaps": [],
  "next_read": [
    "examples\\bmad-mapping-demo\\architecture.md"
  ]
}
