{
  "task_id": "yunshu-full-cycle-component-validation",
  "context_id": "full-cycle-accept",
  "phase": "accept",
  "created_at": "2026-05-13T02:27:31Z",
  "updated_at": "2026-05-13T02:27:31Z",
  "sources": [
    {
      "path": "tmp-yunshu-full-cycle-demo\\acceptance_evidence.json",
      "exists": true,
      "sha256": "7335f7fbced0d3f49f513c1fea98cd8216d6c960ef619b411823d4ff3a0417ea",
      "size": 1107,
      "modified_at": "2026-05-13T02:27:04Z"
    },
    {
      "path": "tmp-yunshu-full-cycle-demo\\src\\evidence_summary.py",
      "exists": true,
      "sha256": "27e3b6369f09b158259acb6cdc4ab660820621fe90fd411b15a192e4ef71912c",
      "size": 895,
      "modified_at": "2026-05-13T02:25:39Z"
    },
    {
      "path": "tmp-yunshu-full-cycle-demo\\tests\\test_evidence_summary.py",
      "exists": true,
      "sha256": "e27ab83d49ac8b2fd498e254d03f842a216a055246018705e65dd7ea3e41150a",
      "size": 1291,
      "modified_at": "2026-05-13T02:22:22Z"
    }
  ],
  "findings": [
    "04-accept passed with structured evidence mapped to each DoD."
  ],
  "actions": [
    "validate evidence passed via verify run."
  ],
  "decisions": [],
  "gaps": [
    "07-subagent execution is assessed by doc/template/gate validation, not spawned."
  ],
  "next_read": [
    "reports/full-cycle-component-validation-20260513.md"
  ]
}
