{
  "task_id": "yunshu-context-ledger",
  "context_id": "yunshu-context-ledger-deliver",
  "phase": "deliver",
  "created_at": "2026-05-10T02:55:45Z",
  "updated_at": "2026-05-10T02:55:45Z",
  "sources": [
    {
      "path": "SKILL.md",
      "exists": true,
      "sha256": "511cc8518a94d473b89c2801100ec80bf15a3306df5bb2d984ba73c4b83c73c6",
      "size": 15461,
      "modified_at": "2026-05-10T02:50:57Z"
    },
    {
      "path": "components/01-init/SKILL.md",
      "exists": true,
      "sha256": "1c76ddec5a9a30db69208df3b32b56c27c1ac2f929209cc97acaded260d23040",
      "size": 16757,
      "modified_at": "2026-05-10T02:51:15Z"
    },
    {
      "path": "components/02-plan/SKILL.md",
      "exists": true,
      "sha256": "61b30170e0503ee14c2553053eed009f6d8cb895d2cf15af754c5e86143999ab",
      "size": 12532,
      "modified_at": "2026-05-10T02:51:26Z"
    },
    {
      "path": "components/05-deliver/SKILL.md",
      "exists": true,
      "sha256": "ec54a8a2f95312c81c7553351432cf871ef864614c73b1ecb6883975894cd5dc",
      "size": 9406,
      "modified_at": "2026-05-10T02:51:36Z"
    },
    {
      "path": "components/06-recover/SKILL.md",
      "exists": true,
      "sha256": "a79037ec53c0cbf9c57a5475c26fce7fba2de288c79ddb593e41c4be4448759f",
      "size": 11184,
      "modified_at": "2026-05-10T02:51:52Z"
    },
    {
      "path": "safeguards/context.md",
      "exists": true,
      "sha256": "d559fb458e792dce1d22c4b571f43761cc69648a71473a05e514b785f26e3564",
      "size": 7121,
      "modified_at": "2026-05-10T02:52:22Z"
    },
    {
      "path": "scripts/yunshu.py",
      "exists": true,
      "sha256": "dc0a827aab9abd20fb769af8957050ea0f6f0149f857c99bc795abd53691a487",
      "size": 34291,
      "modified_at": "2026-05-10T02:54:08Z"
    },
    {
      "path": "tests/test_yunshu_cli.py",
      "exists": true,
      "sha256": "072f40b897645804184baddf5e92ed7538649abfe10a3cf46ee61537ce5abddf",
      "size": 7704,
      "modified_at": "2026-05-10T02:53:21Z"
    },
    {
      "path": "schemas/context_ledger.schema.json",
      "exists": true,
      "sha256": "1b72d2aa128b64517ab25a763badb0e4ce1ab97540ff83e81140e3bec8889481",
      "size": 2075,
      "modified_at": "2026-05-10T02:50:24Z"
    },
    {
      "path": "templates/context_ledger.md",
      "exists": true,
      "sha256": "0b01f666a984ae59a1450302a7182ddc9405e55c486da538f6490ce646f5b49a",
      "size": 1481,
      "modified_at": "2026-05-10T02:50:39Z"
    },
    {
      "path": "https://docs.cline.bot/features/memory-bank"
    },
    {
      "path": "https://aider.chat/docs/repomap.html"
    },
    {
      "path": "https://docs.openhands.dev/overview/skills/repo"
    },
    {
      "path": "https://code.claude.com/docs/en/memory"
    },
    {
      "path": "https://developers.openai.com/codex/guides/agents-md"
    }
  ],
  "findings": [
    "同类项目共同模式：持久项目指令、结构化记忆、仓库摘要索引、按需加载和检查点分工；云舒缺少记录已读来源与结论新鲜度的账本。",
    "新增 .yunshu/context/ 账本，记录 sources/findings/actions/decisions/gaps/next_read，并用 sha256 判断本地来源 fresh/stale/missing。"
  ],
  "actions": [
    "实现 context record/list/show/status 与 validate context，并让 checkpoint create 自动关联同 task_id 最新 context ledger。",
    "更新 01-init、02-plan、05-deliver、06-recover、context safeguard、README 和模板，使恢复时先查账本再补读。"
  ],
  "decisions": [
    "保留 checkpoint 作为阶段恢复事实源，新增 context ledger 作为调查复现事实源，避免把两类状态混在一个文件里。"
  ],
  "gaps": [
    "后续可增加自动扫描 git diff 生成 source 列表，以及更细的目录指纹策略。"
  ],
  "next_read": [
    "下次优化先运行 context show/status yunshu-context-ledger-deliver，再只补读 stale/missing 文件和新增需求涉及文件。"
  ]
}
