{
  "task_id": "meta-cognition-output-sufficiency",
  "context_id": "meta-cognition-output-sufficiency-execute-20260511-091253",
  "phase": "deliver",
  "created_at": "2026-05-11T01:12:53Z",
  "updated_at": "2026-05-11T01:16:34Z",
  "sources": [
    {
      "path": "safeguards/meta-cognition.md",
      "exists": true,
      "sha256": "f17af3bf3d828936411d908bc5c26a418d5d61e06ec52e183715048dc6dba3ed",
      "size": 9546,
      "modified_at": "2026-05-11T01:12:30Z"
    },
    {
      "path": "SKILL.md",
      "exists": true,
      "sha256": "409ba93d9b4db166a04f916fb024d834c0bac45e70fa33e3c506590e4b2b61ee",
      "size": 16366,
      "modified_at": "2026-05-11T01:12:30Z"
    },
    {
      "path": "README.md",
      "exists": true,
      "sha256": "e2e13cc3a296befc531edee2880766c6f0b8eb556326085e551938de40c49d28",
      "size": 26229,
      "modified_at": "2026-05-11T01:12:30Z"
    },
    {
      "path": "components"
    },
    {
      "path": "agents"
    },
    {
      "path": "templates"
    },
    {
      "path": "reports/meta-cognition-output-sufficiency-research-20260511.md",
      "exists": true,
      "sha256": "e36a038e826cc4c6098ad82b076eb7b32a2f166c4d80cfb4e1249d001f0da9ff",
      "size": 5337,
      "modified_at": "2026-05-11T01:12:30Z"
    },
    {
      "path": "reports/meta-cognition-output-sufficiency-evidence-20260511.json",
      "exists": true,
      "sha256": "129fc08e4fb0905d77d98500a5583a17f2ce365cc7c6491a48e8cd243754d76e",
      "size": 2156,
      "modified_at": "2026-05-11T01:16:19Z"
    }
  ],
  "findings": [
    "用户提出的输出前自问经验与Self-Refine/Reflexion/Chain-of-Verification/Metacognitive Prompting等方法同向；有效但不能替代外部证据",
    "结构化验收证据已补充，包含研究、接入、验证和恢复四类DoD"
  ],
  "actions": [
    "新增输出充分性门禁，接入全局、01-07组件、三类子智能体和模板，并新增研究报告",
    "validate evidence 通过，并通过 verify run 记录声明级证据"
  ],
  "decisions": [
    "采用能查先查、阻塞再问、非阻塞明示假设/限制的缺口分级策略",
    "保留失败验证日志作为调试证据，同时用拆分rg声明建立通过证据链"
  ],
  "gaps": [
    "尚未做真实A/B评测集量化效果",
    "尚未做真实A/B评测集量化效果"
  ],
  "next_read": [
    "后续可读取reports/meta-cognition-output-sufficiency-research-20260511.md和safeguards/meta-cognition.md继续迭代",
    "reports/meta-cognition-output-sufficiency-evidence-20260511.json"
  ]
}
