{
  "task_id": "bmad-yunshu-enhancement-v1",
  "context_id": "bmad-yunshu-enhancement-v1-execute-20260513-091517",
  "phase": "execute",
  "created_at": "2026-05-13T01:15:17Z",
  "updated_at": "2026-05-13T01:15:17Z",
  "sources": [
    {
      "path": "components\\bmad-enhance\\SKILL.md",
      "exists": true,
      "sha256": "37ce3225e50a604861c9a644ef3df59263930da0fab5cb6565cd7bd309524749",
      "size": 5235,
      "modified_at": "2026-05-12T14:04:11Z"
    },
    {
      "path": "components\\bmad-enhance\\prd-map.md",
      "exists": true,
      "sha256": "eeab80abe5e6284ab4f6fe7003333a3224044b56e214698f3297191165eb83b8",
      "size": 2483,
      "modified_at": "2026-05-12T14:04:11Z"
    },
    {
      "path": "components\\bmad-enhance\\architecture-map.md",
      "exists": true,
      "sha256": "e77046e0f515b3dd0f7990eeef854dce6ab0f25af8f98a925193ad5d6246d076",
      "size": 2478,
      "modified_at": "2026-05-12T14:04:11Z"
    },
    {
      "path": "components\\bmad-enhance\\story-map.md",
      "exists": true,
      "sha256": "4f9afcd0d3b1610644fa83e75061dd7a9825f02651dbdd9c5f7567e9e183808b",
      "size": 2596,
      "modified_at": "2026-05-12T14:04:11Z"
    },
    {
      "path": "components\\bmad-enhance\\project-context-sync.md",
      "exists": true,
      "sha256": "1de28d79d3472f8cd91f96543632ed1cae4707fbd7d7211e10dbacbfad847fd6",
      "size": 2899,
      "modified_at": "2026-05-12T14:04:11Z"
    },
    {
      "path": "templates\\bmad_prd_map.md",
      "exists": true,
      "sha256": "d7c8d14ca44ba68cbbad9d1aa6bb5fa50ca59558963e5937b3b909319b61ef46",
      "size": 970,
      "modified_at": "2026-05-12T14:04:11Z"
    },
    {
      "path": "templates\\bmad_architecture_map.md",
      "exists": true,
      "sha256": "bf960fe342ec713f031b265d74909e48c1ea6f4181cc1b7e1bbbe34b56043e03",
      "size": 1150,
      "modified_at": "2026-05-12T14:04:11Z"
    },
    {
      "path": "templates\\bmad_story_map.md",
      "exists": true,
      "sha256": "01ac5e7d46e54c9d3e3fc64170b5605dc9be09698b6886b17b18db18ac425fdf",
      "size": 1110,
      "modified_at": "2026-05-12T14:04:11Z"
    },
    {
      "path": "templates\\bmad_project_context.md",
      "exists": true,
      "sha256": "57ee0fb119e2695bed9bd3acbcdb534698f8e0a15d7c83f56337fe5da0594c45",
      "size": 1124,
      "modified_at": "2026-05-12T14:04:11Z"
    },
    {
      "path": "SKILL.md",
      "exists": true,
      "sha256": "2b3f1a86a357c728ac83467d0da484e96bc5241660b92150bb2f69469e4f8a64",
      "size": 17248,
      "modified_at": "2026-05-12T14:05:51Z"
    },
    {
      "path": "README.md",
      "exists": true,
      "sha256": "437cc84f4c2d1d555fa51f9876391f40f1040a4c7bd252aa50dc6297b41860b5",
      "size": 28222,
      "modified_at": "2026-05-13T01:13:16Z"
    }
  ],
  "findings": [
    "P0 已落地：新增 bmad-enhance 可选增强组件、4 个映射规则文档、4 个 bmad 模板，并在 SKILL.md/README.md 中登记。"
  ],
  "actions": [
    "通过 audit links、version-check、pytest tests，并写入 verify-log.tsv。"
  ],
  "decisions": [
    "本轮只完成 P0 文档增强闭环，不做 P1 CLI/schema 或 P2 Party Mode。"
  ],
  "gaps": [
    "尚未做真实 BMad 样例映射演练。"
  ],
  "next_read": [
    "下一轮先读取 components/bmad-enhance/SKILL.md 与四个 map 文档。"
  ]
}
