{
  "task_id": "yunshu-component-audit-20260527",
  "context_id": "yunshu-component-audit-20260527-accept",
  "phase": "accept",
  "created_at": "2026-05-27T02:26:53Z",
  "updated_at": "2026-05-27T02:26:53Z",
  "sources": [
    {
      "path": "SKILL.md",
      "exists": true,
      "sha256": "f53d6da52b278ff10d97cd9c2760fc1593bcb22f3f578eac9fce65f40dde164e",
      "size": 19561,
      "modified_at": "2026-05-27T00:08:05Z"
    },
    {
      "path": "README.md",
      "exists": true,
      "sha256": "96bf1bec62f5d5a2d4cc601eb18e3038f993ea832e29b12ce66cd5ae8634899c",
      "size": 30925,
      "modified_at": "2026-05-13T15:44:32Z"
    },
    {
      "path": "scripts\\yunshu.py",
      "exists": true,
      "sha256": "2d7a5b1fc88a32800ac323e92722bb61caf82a986dbdbdd76ab69a1211cebf1a",
      "size": 46184,
      "modified_at": "2026-05-27T02:21:47Z"
    },
    {
      "path": "scripts\\yunshu-health.ps1",
      "exists": true,
      "sha256": "2bb4621827d940850503a4e5c22974ceaa5e3ac52df2f6d8e0b9caa280ce3b26",
      "size": 9539,
      "modified_at": "2026-05-27T02:17:13Z"
    },
    {
      "path": "tests\\test_yunshu_cli.py",
      "exists": true,
      "sha256": "fb0ec9a3323bb66f00124963691028ca1720fd7b533e44d8a795db34c6854bf9",
      "size": 13484,
      "modified_at": "2026-05-27T02:22:02Z"
    },
    {
      "path": "components\\08-domain-guide\\SKILL.md",
      "exists": true,
      "sha256": "f088402469e234a021446b6be41b34b35e0ce1a15c39e21451265bee2fc9b66b",
      "size": 4513,
      "modified_at": "2026-05-27T02:17:30Z"
    },
    {
      "path": "components\\08-domain-guide\\guide-engine.md",
      "exists": true,
      "sha256": "342e8c371783f097c1810d4ba22ae452065c2afaf1180a4b5862efb50d6ed7a6",
      "size": 7396,
      "modified_at": "2026-05-27T02:17:30Z"
    },
    {
      "path": "components\\09-software-bridge\\execution-sandbox.md",
      "exists": true,
      "sha256": "8c1375e11f79216ef67339518934ee16fe49e3e84f5d5456aec8b73e618c3b4c",
      "size": 2773,
      "modified_at": "2026-05-27T02:17:30Z"
    },
    {
      "path": "reports\\yunshu-system-component-audit-20260527.md",
      "exists": true,
      "sha256": "f6f0f7d8caba50d1a857cce7b0d77787969a0246b3d2ec4c024068ea764ea064",
      "size": 2781,
      "modified_at": "2026-05-27T02:26:38Z"
    }
  ],
  "findings": [
    "Audited Yunshu source and Codex installed package after 2026-05-27 update.",
    "Fixed optional adapter version-check crash, health checklist gaps, platform-specific interaction wording, and checkpoint list task filtering."
  ],
  "actions": [
    "Ran external tmp-yunshu-component-audit instance through init/context/verify/bmad/validate/checkpoint/resume.",
    "Ran pytest, version-check, audit links, health script, py_compile, JSON parse checks, and sync-trae dry-run."
  ],
  "decisions": [
    "Keep subagent behavior adapter-gated",
    "no Codex subagents used because no explicit delegation was requested."
  ],
  "gaps": [
    "Live Trae and Claude Code interactive UI behavior remains document-audited rather than executed."
  ],
  "next_read": [
    "reports\\yunshu-system-component-audit-20260527.md"
  ]
}
