{
  "task_id": "bmad-yunshu-enhancement-v1",
  "context_id": "bmad-yunshu-enhancement-v1-deliver-20260513-093116",
  "phase": "deliver",
  "created_at": "2026-05-13T01:31:16Z",
  "updated_at": "2026-05-13T01:31:16Z",
  "sources": [
    {
      "path": "scripts\\yunshu.py",
      "exists": true,
      "sha256": "be82e71be9f9785de93dc18601db0b369289f7cef323b8825cc7ac9423db65b9",
      "size": 44771,
      "modified_at": "2026-05-13T01:23:52Z"
    },
    {
      "path": "schemas\\bmad_mapping.schema.json",
      "exists": true,
      "sha256": "ddb5e8e62b7fd9a0dab3371702e037c121efc43b5972e81647464a42e33d7f81",
      "size": 2388,
      "modified_at": "2026-05-13T01:24:37Z"
    },
    {
      "path": "components\\bmad-enhance\\party-mode-gate.md",
      "exists": true,
      "sha256": "f44fa20dbaf9b3c678d57d114a541071cba8d9ba6cd98be61dafa6145ac023df",
      "size": 1921,
      "modified_at": "2026-05-13T01:26:03Z"
    },
    {
      "path": "components\\bmad-enhance\\bmad-cli-adapter.md",
      "exists": true,
      "sha256": "90109196c8516683968669a9e2086da04ff16f6cb69c4432d40fba71726d1d96",
      "size": 1653,
      "modified_at": "2026-05-13T01:26:03Z"
    },
    {
      "path": "examples\\bmad-mapping-demo\\README.md",
      "exists": true,
      "sha256": "f947e33cae60ecb1b1c697f345276a156cc28ffe007bbd4258a8480fd33c35b7",
      "size": 1359,
      "modified_at": "2026-05-13T01:28:01Z"
    },
    {
      "path": "examples\\bmad-mapping-demo\\PRD.md",
      "exists": true,
      "sha256": "0f7e6d6d2da9b531a0541f46596598e0daa21157f8affdc90e8f7e4a6e8e899a",
      "size": 774,
      "modified_at": "2026-05-13T01:26:40Z"
    },
    {
      "path": "examples\\bmad-mapping-demo\\architecture.md",
      "exists": true,
      "sha256": "724ad87ffea0a675240154245a8b687a011acc466a98a440e252acbd7b58ce45",
      "size": 806,
      "modified_at": "2026-05-13T01:26:40Z"
    },
    {
      "path": "examples\\bmad-mapping-demo\\story-cli-evidence-dashboard.md",
      "exists": true,
      "sha256": "6740a88259a2ecaa49d574757a22875a673b560d7b1331abea046dcb9fa48a2b",
      "size": 649,
      "modified_at": "2026-05-13T01:26:40Z"
    },
    {
      "path": "examples\\bmad-mapping-demo\\project-context.md",
      "exists": true,
      "sha256": "e0f4810d215f21933155cde4855a9a95bc481dfc61f2b10644e9b7d91a42c8b3",
      "size": 443,
      "modified_at": "2026-05-13T01:26:40Z"
    },
    {
      "path": "tests\\test_yunshu_cli.py",
      "exists": true,
      "sha256": "4e691c1b535235f1d48f1b2f4b4e28d95231791b708d568bee3d9fe6f6e85277",
      "size": 10264,
      "modified_at": "2026-05-13T01:24:37Z"
    },
    {
      "path": "README.md",
      "exists": true,
      "sha256": "ba87b07617b98bf085253be07262e2d010e6d0c29b97959cdfcb4c0825cf2aa4",
      "size": 29791,
      "modified_at": "2026-05-13T01:29:22Z"
    },
    {
      "path": "SKILL.md",
      "exists": true,
      "sha256": "69b01628763112fb1e95d52c72568692bb539be2b87a300c75906dc69256a7ed",
      "size": 17646,
      "modified_at": "2026-05-13T01:29:22Z"
    }
  ],
  "findings": [
    "P1/P2 已完成：新增 bmad map/status/validate、bmad_mapping schema、Party Mode 门禁、BMad CLI 可选适配说明、端到端映射样例。",
    "版本已提升到 3.6.0；BMad CLI 仍为可选外部工具，不是运行依赖。"
  ],
  "actions": [
    "运行 audit links、version-check、pytest tests、四个 demo mapping validate，全部通过，并用 verify run 留证。"
  ],
  "decisions": [
    "完成 V1 文档中 P0/P1/P2；不安装 BMad CLI，不把 Party Mode 设为默认流程。"
  ],
  "gaps": [
    "尚未接入真实 BMad 官方模板；当前样例为本地最小演练。"
  ],
  "next_read": [
    "如继续，读取 examples/bmad-mapping-demo 与 .yunshu/bmad/demo-*.json，选择真实项目产物进行校准。"
  ]
}
