{
  "task_id": "yunshu-full-cycle-component-validation",
  "context_id": "full-cycle-deliver",
  "phase": "deliver",
  "created_at": "2026-05-13T02:29:11Z",
  "updated_at": "2026-05-13T02:29:11Z",
  "sources": [
    {
      "path": "reports\\full-cycle-component-validation-20260513.md",
      "exists": true,
      "sha256": "e83724182e05b6cce69e29c30ac7c4a8628d463e4aea1b2a8d8e08c036910e6b",
      "size": 5454,
      "modified_at": "2026-05-13T02:28:45Z"
    },
    {
      "path": "tmp-yunshu-full-cycle-demo\\docs\\task_card.md",
      "exists": true,
      "sha256": "efc1e9e09215f2d7fcfe2f7db1d0d51562fe0f09d95403817b0927b30aa3fec8",
      "size": 836,
      "modified_at": "2026-05-13T02:22:22Z"
    },
    {
      "path": "tmp-yunshu-full-cycle-demo\\acceptance_evidence.json",
      "exists": true,
      "sha256": "7335f7fbced0d3f49f513c1fea98cd8216d6c960ef619b411823d4ff3a0417ea",
      "size": 1107,
      "modified_at": "2026-05-13T02:27:04Z"
    },
    {
      "path": "tmp-yunshu-full-cycle-demo\\src\\evidence_summary.py",
      "exists": true,
      "sha256": "27e3b6369f09b158259acb6cdc4ab660820621fe90fd411b15a192e4ef71912c",
      "size": 895,
      "modified_at": "2026-05-13T02:25:39Z"
    },
    {
      "path": "tmp-yunshu-full-cycle-demo\\tests\\test_evidence_summary.py",
      "exists": true,
      "sha256": "e27ab83d49ac8b2fd498e254d03f842a216a055246018705e65dd7ea3e41150a",
      "size": 1291,
      "modified_at": "2026-05-13T02:22:22Z"
    }
  ],
  "findings": [
    "Full Yunshu workflow instance completed from task card to delivery and recovery proof.",
    "All tested components are usable",
    "07-subagent is conditionally usable under Codex explicit authorization."
  ],
  "actions": [
    "Created reports/full-cycle-component-validation-20260513.md."
  ],
  "decisions": [
    "No blocking conflict, redundancy, or error found in the tested workflow."
  ],
  "gaps": [
    "Real BMad official artifact calibration remains future work."
  ],
  "next_read": [
    "reports/full-cycle-component-validation-20260513.md"
  ]
}
